export const list = [    
    {
        id: 1,
        name:"Scenic_001",
        dateTaken: "2010-02-24",
        description: "Sight-sizing studies, light and shadow. Charcoal., chalk, and scenic paint",
        project: "Undergraduate Studies",
        location: "University of Minnesota",
        src:"assets/images/scenic/Scenic_001_02.24.2010.jpg"
    },
    {
        id: 2,
        name:"Scenic_002",
        dateTaken: "2010-04-28",
        description: "Stencil, woodgrain, light. Scenic paint on muslin.",
        project: "Undergraduate Studies",
        location: "University of Minnesota",
        src:"assets/images/scenic/Scenic_002_04.28.2010.jpg"
    },
    {
        id: 3,
        name:"Scenic_003",
        dateTaken: "2010-05-12",
        description: "Final drawing project, light, shape, shadow. Dry pigment on canvas.",
        project: "Undergraduate Studies",
        location: "University of Minnesota",
        src:"assets/images/scenic/Scenic_003_05.12.2010.jpg"
    },
    {
        id: 4,
        name:"Scenic_004",
        dateTaken: "2011-02-23",
        description: "Natural setting. Dry pigment on muslin.",
        project: "Undergraduate Studies",
        location: "University of Minnesota",
        src:"assets/images/scenic/Scenic_004_02.23.2011.jpg"
    },
    {
        id: 5,
        name:"Scenic_005",
        dateTaken: "2011-03-07",
        description: "Drapery and light. Dry pigment on canvas.",
        project: "Undergraduate Studies",
        location: "University of Minnesota",
        src:"assets/images/scenic/Scenic_005_03.07.2011.jpg"
    },
    {
        id: 6,
        name:"Scenic_006",
        dateTaken: "2011-03-21",
        description: "Drawing, composition, type. Pounce.",
        project: "Demon Barber of Fleet Street",
        location: "University of Minnesota - Centential Showboat",
        src:"assets/images/scenic/Scenic_006_03.21.2011.jpg"
    },
    {
        id: 7,
        name:"Scenic_007",
        dateTaken: "2011-05-18",
        description: "Completed drop. Scenic Paint on muslin.",
        project: "Demon Barber of Fleet Street",
        location: "University of Minnesota - Centential Showboat",
        src:"assets/images/scenic/Scenic_007_05.18.2011.jpg"
    },
    {
        id: 8,
        name:"Scenic_008",
        dateTaken: "2012-02-07",
        description: "Poseidon head costume. Carboard, trash bags, etc.",
        project: "The Birds",
        location: "University of Minnesota - Whiting Proscenium",
        src:"assets/images/scenic/Scenic_008_02.07.2012.jpg"
    },
    {
        id: 9,
        name:"Scenic_009",
        dateTaken: "2012-02-09",
        description: "Poseidon head costume. Carboard, trash bags, etc.",
        project: "The Birds",
        location: "University of Minnesota - Whiting Proscenium",
        src:"assets/images/scenic/Scenic_009_02.09.2012.jpg"
    },
    {
        id: 10,
        name:"Scenic_010",
        dateTaken: "2012-09-20",
        description: "Floor painting. Scenic paint.",
        project: "The Rover",
        location: "University of Minnesota - Stoll Thrust Theatre",
        src:"assets/images/scenic/Scenic_010_09.20.2012.jpg"
    },
    {
        id: 11,
        name:"Scenic_011",
        dateTaken: "2012-10-23",
        description: "Scenic paint and styrofoam stulpture.",
        project: "The Rover",
        location: "University of Minnesota - Stoll Thrust Theatre",
        src:"assets/images/scenic/Scenic_011_10.23.2012.jpg"
    },
    {
        id: 12,
        name:"Scenic_012",
        dateTaken: "2012-10-23",
        description: "Scenic paint and styrofoam stulpture.",
        project: "The Rover",
        location: "University of Minnesota - Stoll Thrust Theatre",
        src:"assets/images/scenic/Scenic_012_10.23.2012.jpg"
    },
    {
        id: 13,
        name:"Scenic_013",
        dateTaken: "2012-10-23",
        description: "Scenic paint and styrofoam stulpture.",
        project: "The Rover",
        location: "University of Minnesota - Stoll Thrust Theatre",
        src:"assets/images/scenic/Scenic_013_10.23.2012.jpg"
    },
    {
        id: 14,
        name:"Scenic_014",
        dateTaken: "2012-10-23",
        description: "Scenic paint and styrofoam stulpture.",
        project: "The Rover",
        location: "University of Minnesota - Stoll Thrust Theatre",
        src:"assets/images/scenic/Scenic_014_10.23.2012.jpg"
    },
    {
        id: 15,
        name:"Scenic_015",
        dateTaken: "2013-01-18",
        description: "Dry pigment palette recreation, enamel.",
        project: "Creating the World for the Stage, 1893-1929: An Exhibit of Scenic Sketches from the Collections of the Performing Arts Archives at the Elmer L. Andersen Library",
        location: "University of Minnesota",
        src:"assets/images/scenic/Scenic_015_01.18.2013.jpg"
    },
    {
        id: 16,
        name:"Scenic_016",
        dateTaken: "2013-01-18",
        description: "Dry pigment palette recreation, enamel.",
        project: "Creating the World for the Stage, 1893-1929: An Exhibit of Scenic Sketches from the Collections of the Performing Arts Archives at the Elmer L. Andersen Library",
        location: "University of Minnesota",
        src:"assets/images/scenic/Scenic_016_01.18.2013.jpg"
    },
    {
        id: 17,
        name:"Scenic_017",
        dateTaken: "2013-04-04",
        description: "Kitchen/factory in process. Paint and design.",
        project: "Alice in Wonderland",
        location: "Carleton College",
        src:"assets/images/scenic/Scenic_017_04.04.2013.jpg"
    },
    {
        id: 18,
        name:"Scenic_018",
        dateTaken: "2013-04-04",
        description: "Scenic flat. Paint and design.",
        project: "Alice in Wonderland",
        location: "Carleton College",
        src:"assets/images/scenic/Scenic_018_04.04.2013.jpg"
    },
    {
        id: 19,
        name:"Scenic_019",
        dateTaken: "2013-04-08",
        description: "Show drop, cartooning.",
        project: "Alice in Wonderland",
        location: "Children's Theatre Company - UnitedHealth Group Stage",
        src:"assets/images/scenic/Scenic_019_04.08.2013.jpg"
    },
    {
        id: 20,
        name:"Scenic_020",
        dateTaken: "2013-04-08",
        description: "Show drop, cartooning.",
        project: "Alice in Wonderland",
        location: "Children's Theatre Company - UnitedHealth Group Stage",
        src:"assets/images/scenic/Scenic_020_04.08.2013.jpg"
    },
    {
        id: 21,
        name:"Scenic_021",
        dateTaken: "2013-04-10",
        description: "Scenic house flat, design and paint.",
        project: "Alice in Wonderland",
        location: "Carleton College",
        src:"assets/images/scenic/Scenic_021_04.10.2013.jpg"
    },
    {
        id: 22,
        name:"Scenic_022",
        dateTaken: "2013-04-10",
        description: "Kitchen/factory, design and paint.",
        project: "Alice in Wonderland",
        location: "Carleton College",
        src:"assets/images/scenic/Scenic_022_04.10.2013.jpg"
    },
    {
        id: 23,
        name:"Scenic_023",
        dateTaken: "2013-04-10",
        description: "Mad hatter flat, design and paint.",
        project: "Alice in Wonderland",
        location: "Carleton College",
        src:"assets/images/scenic/Scenic_023_04.10.2013.jpg"
    },
    {
        id: 24,
        name:"Scenic_024",
        dateTaken: "2013-04-16",
        description: "Modular carts, transforming set. Design and paint.",
        project: "South Street",
        location: "Guthrie Theater - Dowling Studio",
        src:"assets/images/scenic/Scenic_024_04.16.2013.jpg"
    },
    {
        id: 25,
        name:"Scenic_025",
        dateTaken: "2013-04-16",
        description: "Modular carts, transforming set. Design and paint.",
        project: "South Street",
        location: "Guthrie Theater - Dowling Studio",
        src:"assets/images/scenic/Scenic_025_04.16.2013.jpg"
    },
    {
        id: 26,
        name:"Scenic_026",
        dateTaken: "2013-04-22",
        description: "Show drop, cartooning and paint.",
        project: "Alice in Wonderland",
        location: "Children's Theatre Company - UnitedHealth Group Stage",
        src:"assets/images/scenic/Scenic_026_04.22.2013.jpg"
    },
    {
        id: 27,
        name:"Scenic_027",
        dateTaken: "2013-04-22",
        description: "Show drop, cartooning and paint.",
        project: "Alice in Wonderland",
        location: "Children's Theatre Company - UnitedHealth Group Stage",
        src:"assets/images/scenic/Scenic_027_04.22.2013.jpg"
    },
    {
        id: 28,
        name:"Scenic_028",
        dateTaken: "2013-04-30",
        description: "Scenery, paint.",
        project: "Alice in Wonderland",
        location: "Children's Theatre Company - UnitedHealth Group Stage",
        src:"assets/images/scenic/Scenic_028_04.30.2013.jpg"
    },
    {
        id: 29,
        name:"Scenic_029",
        dateTaken: "2013-05-23",
        description: "Completed show drop.",
        project: "Alice in Wonderland",
        location: "Children's Theatre Company - UnitedHealth Group Stage",
        src:"assets/images/scenic/Scenic_029_05.23.2013.jpg"
    },
    {
        id: 30,
        name:"Scenic_030",
        dateTaken: "2013-07-12",
        description: "Paint on windowscreen.",
        project: "On Golden Pond",
        location: "Artistry (formally Bloomington Civic Theater)",
        src:"assets/images/scenic/Scenic_030_07.12.2013.jpg"
    },
    {
        id: 31,
        name:"Scenic_031",
        dateTaken: "2013-07-12",
        description: "Paint on windowscreen.",
        project: "On Golden Pond",
        location: "Artistry (formally Bloomington Civic Theater)",
        src:"assets/images/scenic/Scenic_031_07.12.2013.jpg"
    },
    {
        id: 32,
        name:"Scenic_032",
        dateTaken: "2013-07-12",
        description: "Interior/exterior backdrop.",
        project: "On Golden Pond",
        location: "Artistry (formally Bloomington Civic Theater)",
        src:"assets/images/scenic/Scenic_032_07.12.2013.jpg"
    },
    {
        id: 33,
        name:"Scenic_033",
        dateTaken: "2013-09-23",
        description: "Book bindings. Paint on styrofoam.",
        project: "Tribes",
        location: "Guthrie Theater - McGuire Proscenium Stage",
        src:"assets/images/scenic/Scenic_033_09.23.2013.jpg"
    },
    {
        id: 34,
        name:"Scenic_034",
        dateTaken: "2013-09-23",
        description: "Book bindings. Paint on styrofoam.",
        project: "Tribes",
        location: "Guthrie Theater - McGuire Proscenium Stage",
        src:"assets/images/scenic/Scenic_034_09.23.2013.jpg"
    },
    {
        id: 35,
        name:"Scenic_035",
        dateTaken: "2013-09-23",
        description: "Book bindings. Paint on styrofoam.",
        project: "Tribes",
        location: "Guthrie Theater - McGuire Proscenium Stage",
        src:"assets/images/scenic/Scenic_035_09.23.2013.jpg"
    },
    {
        id: 36,
        name:"Scenic_036",
        dateTaken: "2013-09-23",
        description: "Book bindings. Paint on styrofoam.",
        project: "Tribes",
        location: "Guthrie Theater - McGuire Proscenium Stage",
        src:"assets/images/scenic/Scenic_036_09.23.2013.jpg"
    },
    {
        id: 37,
        name:"Scenic_037",
        dateTaken: "2013-09-23",
        description: "Book bindings. Paint on styrofoam.",
        project: "Tribes",
        location: "Guthrie Theater - McGuire Proscenium Stage",
        src:"assets/images/scenic/Scenic_037_09.23.2013.jpg"
    },
    {
        id: 38,
        name:"Scenic_038",
        dateTaken: "2013-10-24",
        description: "Historical backdrop recreation, paint and design.",
        project: "Scenic drop study",
        location: null,
        src:"assets/images/scenic/Scenic_038_10.24.2013.jpg"
    },
    {
        id: 39,
        name:"Scenic_039",
        dateTaken: "2013-10-24",
        description: "Historical backdrop recreation, paint and design.",
        project: "Scenic drop study",
        location: null,
        src:"assets/images/scenic/Scenic_039_10.24.2013.jpg"
    },
    {
        id: 40,
        name:"Scenic_040",
        dateTaken: "2013-10-25",
        description: "Historical backdrop recreation, paint and design.",
        project: "Scenic drop study",
        location: null,
        src:"assets/images/scenic/Scenic_040_10.25.2013.jpg"
    },
    {
        id: 41,
        name:"Scenic_041",
        dateTaken: "2013-12-04",
        description: "Kabuki drop on muslin. Design and paint.",
        project: "Muy Very Authentico",
        location: "Open Eye Figure Theatre",
        src:"assets/images/scenic/Scenic_041_12.04.2013.jpg"
    },
    {
        id: 42,
        name:"Scenic_042",
        dateTaken: "2013-12-05",
        description: "Kabuki drop on muslin. Design and paint.",
        project: "Muy Very Authentico",
        location: "Open Eye Figure Theatre",
        src:"assets/images/scenic/Scenic_042_12.05.2013.jpg"
    },
    {
        id: 43,
        name:"Scenic_043",
        dateTaken: "2013-12-05",
        description: "Kabuki drop on muslin. Design and paint.",
        project: "Muy Very Authentico",
        location: "Open Eye Figure Theatre",
        src:"assets/images/scenic/Scenic_043_12.05.2013.jpg"
    },
    {
        id: 44,
        name:"Scenic_044",
        dateTaken: "2014-02-14",
        description: "Flipper panel. Paint.",
        project: "The Scarecrow and His Servant",
        location: "Children's Theatre Company - UnitedHealth Group Stage",
        src:"assets/images/scenic/Scenic_044_02.14.2014.jpg"
    },
    {
        id: 45,
        name:"Scenic_045",
        dateTaken: "2014-03-07",
        description: "Hanging vines, texture and paint.",
        project: "Shrek the Musical",
        location: "Children's Theatre Company - UnitedHealth Group Stage",
        src:"assets/images/scenic/Scenic_045_03.07.2014.jpg"
    },
    {
        id: 46,
        name:"Scenic_046",
        dateTaken: "2014-03-12",
        description: "Proscenium portal, cartooning.",
        project: "Shrek the Musical",
        location: "Children's Theatre Company - UnitedHealth Group Stage",
        src:"assets/images/scenic/Scenic_046_03.12.2014.jpg"
    },
    {
        id: 47,
        name:"Scenic_047",
        dateTaken: "2014-03-18",
        description: "Proscenium portal, cartooning.",
        project: "Shrek the Musical",
        location: "Children's Theatre Company - UnitedHealth Group Stage",
        src:"assets/images/scenic/Scenic_047_03.18.2014.jpg"
    },
    {
        id: 48,
        name:"Scenic_048",
        dateTaken: "2014-05-01",
        description: "Kitchen stove. Paint and design.",
        project: "Alice and Wonderland",
        location: "Flying Foot Forum - Lehr Theater",
        src:"assets/images/scenic/Scenic_048_05.01.2014.jpg"
    },
    {
        id: 49,
        name:"Scenic_049",
        dateTaken: "2014-05-15",
        description: "Finished set.",
        project: "Shrek the Musical",
        location: "Children's Theatre Company - UnitedHealth Group Stage",
        src:"assets/images/scenic/Scenic_049_05.15.2014.jpg"
    },
    {
        id: 50,
        name:"Scenic_050",
        dateTaken: "2014-07-21",
        description: "Watercolor look with ripped paper, floor paint on osb.",
        project: "Busytown the Musical",
        location: "Children's Theatre Company - UnitedHealth Group Stage",
        src:"assets/images/scenic/Scenic_050_07.21.2014.jpg"
    },
    {
        id: 51,
        name:"Scenic_051",
        dateTaken: "2014-08-04",
        description: "Grinch floor, before repainting.",
        project: "Dr. Seuss’s How the Grinch Stole Christmas",
        location: "Children's Theatre Company - UnitedHealth Group Stage",
        src:"assets/images/scenic/Scenic_051_08.04.2014.jpg"
    },
    {
        id: 52,
        name:"Scenic_052",
        dateTaken: "2014-09-23",
        description: "Chipped and rusting metal finish, paint.",
        project: "Seedfolks",
        location: "Children's Theatre Company - Cargill Stage",
        src:"assets/images/scenic/Scenic_052_09.23.2014.jpg"
    },
    {
        id: 53,
        name:"Scenic_053",
        dateTaken: "2015-01-05",
        description: "Aged and rusted metal. Paint.",
        project: "OLIVER!",
        location: "Theater Latté Da and Hennepin Theatre Trust - Pantages Theatre",
        src:"assets/images/scenic/Scenic_053_01.05.2015.jpg"
    },
    {
        id: 54,
        name:"Scenic_054",
        dateTaken: "2015-01-05",
        description: "Aged exterior and metal.",
        project: "OLIVER!",
        location: "Theater Latté Da and Hennepin Theatre Trust - Pantages Theatre",
        src:"assets/images/scenic/Scenic_054_01.05.2015.jpg"
    },
    {
        id: 55,
        name:"Scenic_055",
        dateTaken: "2015-01-05",
        description: "Aged and rusted metal. Paint.",
        project: "OLIVER!",
        location: "Theater Latté Da and Hennepin Theatre Trust - Pantages Theatre",
        src:"assets/images/scenic/Scenic_055_01.05.2015.jpg"
    },
    {
        id: 56,
        name:"Scenic_056",
        dateTaken: "2015-01-07",
        description: "Aged and rusted metal, glass. Paint.",
        project: "OLIVER!",
        location: "Theater Latté Da and Hennepin Theatre Trust - Pantages Theatre",
        src:"assets/images/scenic/Scenic_056_01.07.2015.jpg"
    },
    {
        id: 57,
        name:"Scenic_057",
        dateTaken: "2015-03-03",
        description: "Jolly roger drop, cartooning, paint. Poor image quality.",
        project: "Peter Pan the Musical",
        location: "Children's Theatre Company - UnitedHealth Group Stage",
        src:"assets/images/scenic/Scenic_057_03.03.2015.jpg"
    },
    {
        id: 58,
        name:"Scenic_058",
        dateTaken: "2015-06-11",
        description: "Repainting corridors to look like submersible.",
        project: "20,000 Leagues Under the Sea",
        location: "Children's Theatre Company - Basement",
        src:"assets/images/scenic/Scenic_058_06.11.2015.jpg"
    },
    {
        id: 59,
        name:"Scenic_059",
        dateTaken: "2015-06-11",
        description: "Repainting corridors to look like submersible.",
        project: "20,000 Leagues Under the Sea",
        location: "Children's Theatre Company - Basement",
        src:"assets/images/scenic/Scenic_059_06.11.2015.jpg"
    },
    {
        id: 60,
        name:"Scenic_060",
        dateTaken: "2015-06-19",
        description: "Submarine console, weathered painted metal.",
        project: "20,000 Leagues Under the Sea",
        location: "Children's Theatre Company - Basement",
        src:"assets/images/scenic/Scenic_060_06.19.2015.jpg"
    },
    {
        id: 61,
        name:"Scenic_061",
        dateTaken: "2015-09-23",
        description: "Banyun roots, tape, pool noodles, chicken wire, muslin and flex glue. Poor image quality.",
        project: "Jungle Book",
        location: "Children's Theatre Company - Cargill Stage",
        src:"assets/images/scenic/Scenic_061_09.23.2015.jpg"
    },
    {
        id: 62,
        name:"Scenic_062",
        dateTaken: "2015-09-25",
        description: "Banyun roots, tape, pool noodles, chicken wire, muslin and flex glue. Poor image quality.",
        project: "Jungle Book",
        location: "Children's Theatre Company - Cargill Stage",
        src:"assets/images/scenic/Scenic_062_09.25.2015.jpg"
    },
    {
        id: 63,
        name:"Scenic_063",
        dateTaken: "2015-09-29",
        description: "Banyun roots, tape, pool noodles, chicken wire, muslin and flex glue. Poor image quality.",
        project: "Jungle Book",
        location: "Children's Theatre Company - Cargill Stage",
        src:"assets/images/scenic/Scenic_063_09.29.2015.jpg"
    },
    {
        id: 65,
        name:"Scenic_065",
        dateTaken: "2016-04-27",
        description: "Building exterior, weathered brick, graffiti.",
        project: "Seedfolks",
        location: "Children's Theatre Company - Cargill Stage",
        src:"assets/images/scenic/Scenic_065_04.27.2016.jpg"
    },
    {
        id: 66,
        name:"Scenic_066",
        dateTaken: "2016-04-27",
        description: "Chipped and rusting metal finish, paint.",
        project: "Seedfolks",
        location: "Children's Theatre Company - Cargill Stage",
        src:"assets/images/scenic/Scenic_066_04.27.2016.jpg"
    },
    {
        id: 67,
        name:"Scenic_067",
        dateTaken: "2016-04-27",
        description: "Rusted metal, weathered concrete.",
        project: "Seedfolks",
        location: "Children's Theatre Company - Cargill Stage",
        src:"assets/images/scenic/Scenic_067_04.27.2016.jpg"
    },
    {
        id: 68,
        name:"Scenic_068",
        dateTaken: "2016-08-02",
        description: "Artistic wooden floor planks, paint on osb.",
        project: "The Last Firefly",
        location: "Children's Theatre Company - Cargill Stage",
        src:"assets/images/scenic/Scenic_068_08.02.2016.jpg"
    },
    {
        id: 69,
        name:"Scenic_069",
        dateTaken: "2016-08-02",
        description: "Artistic wooden floor planks, paint on osb.",
        project: "The Last Firefly",
        location: "Children's Theatre Company - Cargill Stage",
        src:"assets/images/scenic/Scenic_069_08.02.2016.jpg"
    },
    {
        id: 70,
        name:"Scenic_070",
        dateTaken: "2016-08-15",
        description: "Kabuki drop. Fabric ink on polysilk.",
        project: "The Last Firefly",
        location: "Children's Theatre Company - Cargill Stage",
        src:"assets/images/scenic/Scenic_070_08.15.2016.jpg"
    },
    {
        id: 71,
        name:"Scenic_071",
        dateTaken: "2016-08-16",
        description: "Artistic birch tree, gauze and fabric paint.",
        project: "The Last Firefly",
        location: "Children's Theatre Company - Cargill Stage",
        src:"assets/images/scenic/Scenic_071_08.16.2016.jpg"
    },
    {
        id: 72,
        name:"Scenic_072",
        dateTaken: "2016-08-16",
        description: "Artistic birch tree, gauze and fabric paint.",
        project: "The Last Firefly",
        location: "Children's Theatre Company - Cargill Stage",
        src:"assets/images/scenic/Scenic_072_08.16.2016.jpg"
    },
    {
        id: 73,
        name:"Scenic_073",
        dateTaken: "2016-08-19",
        description: "Kabuki drop. Fabric ink on polysilk.",
        project: "The Last Firefly",
        location: "Children's Theatre Company - Cargill Stage",
        src:"assets/images/scenic/Scenic_073_08.19.2016.jpg"
    },
    {
        id: 74,
        name:"Scenic_074",
        dateTaken: "2016-08-26",
        description: "House transparency. Analine dye on muslin.",
        project: "The Last Firefly",
        location: "Children's Theatre Company - Cargill Stage",
        src:"assets/images/scenic/Scenic_074_08.26.2016.jpg"
    },
    {
        id: 75,
        name:"Scenic_075",
        dateTaken: "2016-08-26",
        description: "House transparency. Analine dye on muslin.",
        project: "The Last Firefly",
        location: "Children's Theatre Company - Cargill Stage",
        src:"assets/images/scenic/Scenic_075_08.26.2016.jpg"
    },
    {
        id: 76,
        name:"Scenic_076",
        dateTaken: "2016-10-20",
        description: "Cinderella floor.",
        project: "Cinderella",
        location: "Children's Theatre Company - UnitedHealth Group Stage",
        src:"assets/images/scenic/Scenic_076_10.20.2016.jpg"
    },
    {
        id: 77,
        name:"Scenic_077",
        dateTaken: "2017-01-09",
        description: "Sponge roller technique on muslin covered flat.",
        project: "Dr. Seuss’s The Sneetches The Musical",
        location: "Children's Theatre Company - UnitedHealth Group Stage",
        src:"assets/images/scenic/Scenic_077_01.09.2017.jpg"
    },
    {
        id: 78,
        name:"Scenic_078",
        dateTaken: "2017-01-25",
        description: "Foam carving.",
        project: "Dr. Seuss’s The Sneetches The Musical",
        location: "Children's Theatre Company - UnitedHealth Group Stage",
        src:"assets/images/scenic/Scenic_078_01.25.2017.jpg"
    },
    {
        id: 79,
        name:"Scenic_079",
        dateTaken: "2017-01-25",
        description: "Foam carving.",
        project: "Dr. Seuss’s The Sneetches The Musical",
        location: "Children's Theatre Company - UnitedHealth Group Stage",
        src:"assets/images/scenic/Scenic_079_01.25.2017.jpg"
    },
    {
        id: 80,
        name:"Scenic_080",
        dateTaken: "2017-01-28",
        description: "Coating foam with clay/glue mixture.",
        project: "Dr. Seuss’s The Sneetches The Musical",
        location: "Children's Theatre Company - UnitedHealth Group Stage",
        src:"assets/images/scenic/Scenic_080_01.28.2017.jpg"
    },
    {
        id: 81,
        name:"Scenic_081",
        dateTaken: "2017-01-28",
        description: "Coating foam with clay/glue mixture.",
        project: "Dr. Seuss’s The Sneetches The Musical",
        location: "Children's Theatre Company - UnitedHealth Group Stage",
        src:"assets/images/scenic/Scenic_081_01.28.2017.jpg"
    },
    {
        id: 82,
        name:"Scenic_082",
        dateTaken: "2017-01-30",
        description: "Foamcoat hard finish.",
        project: "Dr. Seuss’s The Sneetches The Musical",
        location: "Children's Theatre Company - UnitedHealth Group Stage",
        src:"assets/images/scenic/Scenic_082_01.30.2017.jpg"
    },
    {
        id: 83,
        name:"Scenic_083",
        dateTaken: "2017-01-30",
        description: "Foamcoat hard finish.",
        project: "Dr. Seuss’s The Sneetches The Musical",
        location: "Children's Theatre Company - UnitedHealth Group Stage",
        src:"assets/images/scenic/Scenic_083_01.30.2017.jpg"
    },
    {
        id: 84,
        name:"Scenic_084",
        dateTaken: "2017-01-31",
        description: "Coating foam with clay/glue mixture.",
        project: "Dr. Seuss’s The Sneetches The Musical",
        location: "Children's Theatre Company - UnitedHealth Group Stage",
        src:"assets/images/scenic/Scenic_084_01.31.2017.jpg"
    },
    {
        id: 85,
        name:"Scenic_085",
        dateTaken: "2017-02-01",
        description: "Scenic flat. Artistic metal rust with sponge roller.",
        project: "Dr. Seuss’s The Sneetches The Musical",
        location: "Children's Theatre Company - UnitedHealth Group Stage",
        src:"assets/images/scenic/Scenic_085_02.01.2017.jpg"
    },
    {
        id: 86,
        name:"Scenic_086",
        dateTaken: "2017-02-06",
        description: "Scenic element. Artistic metal rust with sponge roller.",
        project: "Dr. Seuss’s The Sneetches The Musical",
        location: "Children's Theatre Company - UnitedHealth Group Stage",
        src:"assets/images/scenic/Scenic_086_02.06.2017.jpg"
    },
    {
        id: 87,
        name:"Scenic_087",
        dateTaken: "2017-02-06",
        description: "Artistic metal rust with sponge roller. Textured finish.",
        project: "Dr. Seuss’s The Sneetches The Musical",
        location: "Children's Theatre Company - UnitedHealth Group Stage",
        src:"assets/images/scenic/Scenic_087_02.06.2017.jpg"
    },
    {
        id: 88,
        name:"Scenic_088",
        dateTaken: "2017-02-06",
        description: "Sponge roller technique on muslin covered flat.",
        project: "Dr. Seuss’s The Sneetches The Musical",
        location: "Children's Theatre Company - UnitedHealth Group Stage",
        src:"assets/images/scenic/Scenic_088_02.06.2017.jpg"
    },
    {
        id: 89,
        name:"Scenic_089",
        dateTaken: "2017-02-06",
        description: "Sponge roller technique on muslin covered flat.",
        project: "Dr. Seuss’s The Sneetches The Musical",
        location: "Children's Theatre Company - UnitedHealth Group Stage",
        src:"assets/images/scenic/Scenic_089_02.06.2017.jpg"
    },
    {
        id: 90,
        name:"Scenic_090",
        dateTaken: "2017-02-15",
        description: "Hand-painted lettering.",
        project: "Macy's Flower Show",
        location: "Macy's 8th Floor",
        src:"assets/images/scenic/Scenic_090_02.15.2017.jpg"
    },
    {
        id: 91,
        name:"Scenic_091",
        dateTaken: "2017-04-24",
        description: "Chipped and rusting metal finish, paint.",
        project: "Seedfolks",
        location: "Touring Show",
        src:"assets/images/scenic/Scenic_091_04.24.2017.jpg"
    },
    {
        id: 92,
        name:"Scenic_092",
        dateTaken: "2017-04-27",
        description: "Artistic theater cubes.",
        project: "Seedfolks",
        location: "CTC on Tour",
        src:"assets/images/scenic/Scenic_092_04.27.2017.jpg"
    },
    {
        id: 93,
        name:"Scenic_093",
        dateTaken: "2017-07-21",
        description: "Quick faux marble.",
        project: "Theater Arts Training performances",
        location: "Children's Theatre Company - Cargill Stage",
        src:"assets/images/scenic/Scenic_093_07.21.2017.jpg"
    },
    {
        id: 94,
        name:"Scenic_094",
        dateTaken: "2017-08-04",
        description: "Faux ice floor, HVLP air-brushing, paint on osb.",
        project: "The Abominables",
        location: "Children's Theatre Company - UnitedHealth Group Stage",
        src:"assets/images/scenic/Scenic_094_08.04.2017.jpg"
    },
    {
        id: 95,
        name:"Scenic_095",
        dateTaken: "2017-08-21",
        description: "Textured wood grain, jaxan with graining tools on foam.",
        project: "The Abominables",
        location: "Children's Theatre Company - UnitedHealth Group Stage",
        src:"assets/images/scenic/Scenic_095_08.21.2017.jpg"
    },
    {
        id: 96,
        name:"Scenic_096",
        dateTaken: "2017-08-21",
        description: "Textured wood grain, jaxan with graining tools on foam.",
        project: "The Abominables",
        location: "Children's Theatre Company - UnitedHealth Group Stage",
        src:"assets/images/scenic/Scenic_096_08.21.2017.jpg"
    },
    {
        id: 97,
        name:"Scenic_097",
        dateTaken: "2017-08-29",
        description: "Textured wood grain, jaxan with graining tools on foam and foamcore.",
        project: "The Abominables",
        location: "Children's Theatre Company - UnitedHealth Group Stage",
        src:"assets/images/scenic/Scenic_097_08.29.2017.jpg"
    },
    {
        id: 98,
        name:"Scenic_098",
        dateTaken: "2017-08-29",
        description: "Textured wood grain, jaxan with graining tools on foam and foamcore.",
        project: "The Abominables",
        location: "Children's Theatre Company - UnitedHealth Group Stage",
        src:"assets/images/scenic/Scenic_098_08.29.2017.jpg"
    },
    {
        id: 99,
        name:"Scenic_099",
        dateTaken: "2017-08-29",
        description: "Textured wood grain, jaxan with graining tools on foam and foamcore.",
        project: "The Abominables",
        location: "Children's Theatre Company - UnitedHealth Group Stage",
        src:"assets/images/scenic/Scenic_099_08.29.2017.jpg"
    },
    {
        id: 100,
        name:"Scenic_100",
        dateTaken: "2017-08-30",
        description: "Clean lines. Canadian flag.",
        project: "The Abominables",
        location: "Children's Theatre Company - UnitedHealth Group Stage",
        src:"assets/images/scenic/Scenic_100_08.30.2017.jpg"
    },
    {
        id: 102,
        name:"Scenic_102",
        dateTaken: "2017-09-05",
        description: "Carved foam bricks, clay/glue, paint.",
        project: "The Abominables",
        location: "Children's Theatre Company - UnitedHealth Group Stage",
        src:"assets/images/scenic/Scenic_102_09.05.2017.jpg"
    },
    {
        id: 103,
        name:"Scenic_103",
        dateTaken: "2017-09-22",
        description: "Grinch floor repaint.",
        project: "Dr. Seuss’s How the Grinch Stole Christmas",
        location: "Children's Theatre Company - UnitedHealth Group Stage",
        src:"assets/images/scenic/Scenic_103_09.22.2017.jpg"
    },
    {
        id: 104,
        name:"Scenic_104",
        dateTaken: "2017-10-12",
        description: "Whoville drop repaint, cartooning.",
        project: "Dr. Seuss’s How the Grinch Stole Christmas",
        location: "Children's Theatre Company - UnitedHealth Group Stage",
        src:"assets/images/scenic/Scenic_104_10.12.2017.jpg"
    },
    {
        id: 105,
        name:"Scenic_105",
        dateTaken: "2017-10-13",
        description: "Whoville drop repaint, wetblend, basing.",
        project: "Dr. Seuss’s How the Grinch Stole Christmas",
        location: "Children's Theatre Company - UnitedHealth Group Stage",
        src:"assets/images/scenic/Scenic_105_10.13.2017.jpg"
    },
    {
        id: 106,
        name:"Scenic_106",
        dateTaken: "2017-10-18",
        description: "Whoville drop repaint, wetblend, basing.",
        project: "Dr. Seuss’s How the Grinch Stole Christmas",
        location: "Children's Theatre Company - UnitedHealth Group Stage",
        src:"assets/images/scenic/Scenic_106_10.18.2017.jpg"
    },
    {
        id: 107,
        name:"Scenic_107",
        dateTaken: "2017-10-20",
        description: "Whoville drop repaint, lining.",
        project: "Dr. Seuss’s How the Grinch Stole Christmas",
        location: "Children's Theatre Company - UnitedHealth Group Stage",
        src:"assets/images/scenic/Scenic_107_10.20.2017.jpg"
    },
    {
        id: 108,
        name:"Scenic_108",
        dateTaken: "2017-11-14",
        description: "Whoville drop repaint, finished.",
        project: "Dr. Seuss’s How the Grinch Stole Christmas",
        location: "Children's Theatre Company - UnitedHealth Group Stage",
        src:"assets/images/scenic/Scenic_108_11.14.2017.jpg"
    },
    {
        id: 109,
        name:"Scenic_109",
        dateTaken: "2017-11-16",
        description: "Coney island scenic replica.",
        project: "The Wiz",
        location: "Children's Theatre Company - UnitedHealth Group Stage",
        src:"assets/images/scenic/Scenic_109_11.16.2017.jpg"
    },
    {
        id: 110,
        name:"Scenic_110",
        dateTaken: "2017-12-06",
        description: "Coney island scenic replica, ticket booth in process.",
        project: "The Wiz",
        location: "Children's Theatre Company - UnitedHealth Group Stage",
        src:"assets/images/scenic/Scenic_110_12.06.2017.jpg"
    },
    {
        id: 114,
        name:"Scenic_114",
        dateTaken: "2017-12-06",
        description: "Coney island scenic replica, ticket booth complete.",
        project: "The Wiz",
        location: "Children's Theatre Company - UnitedHealth Group Stage",
        src:"assets/images/scenic/Scenic_114_12.06.2017.jpg"
    },
    {
        id: 115,
        name:"Scenic_115",
        dateTaken: "2017-12-06",
        description: "Coney island scenic replica, ticket booth complete.",
        project: "The Wiz",
        location: "Children's Theatre Company - UnitedHealth Group Stage",
        src:"assets/images/scenic/Scenic_115_12.06.2017.jpg"
    },
    {
        id: 116,
        name:"Scenic_116",
        dateTaken: "2017-12-13",
        description: "Coney island scenic replica, cartooning.",
        project: "The Wiz",
        location: "Children's Theatre Company - UnitedHealth Group Stage",
        src:"assets/images/scenic/Scenic_116_12.13.2017.jpg"
    },
    {
        id: 117,
        name:"Scenic_117",
        dateTaken: "2017-12-15",
        description: "Coney island scenic replica, complete.",
        project: "The Wiz",
        location: "Children's Theatre Company - UnitedHealth Group Stage",
        src:"assets/images/scenic/Scenic_117_12.15.2017.jpg"
    },
    {
        id: 118,
        name:"Scenic_118",
        dateTaken: "2018-03-01",
        description: "Artistic wood finish, in process.",
        project: "Corduroy",
        location: "Children's Theatre Company - Cargill Stage",
        src:"assets/images/scenic/Scenic_118_03.01.2018.jpg"
    },
    {
        id: 119,
        name:"Scenic_119",
        dateTaken: "2018-03-03",
        description: "Artistic wood finish, complete.",
        project: "Corduroy",
        location: "Children's Theatre Company - Cargill Stage",
        src:"assets/images/scenic/Scenic_119_03.03.2018.jpg"
    },
    {
        id: 120,
        name:"Scenic_120",
        dateTaken: "2018-03-06",
        description: "Watercolor effect with ripped paper, proscenium.",
        project: "Corduroy",
        location: "Children's Theatre Company - Cargill Stage",
        src:"assets/images/scenic/Scenic_120_03.06.2018.jpg"
    },
    {
        id: 121,
        name:"Scenic_121",
        dateTaken: "2018-03-19",
        description: "San Francisco drop, cartooning.",
        project: "Guess Who’s Coming to Dinner",
        location: "Guthrie Theater - Wurtele Thrust Stage",
        src:"assets/images/scenic/Scenic_121_03.19.2018.jpg"
    },
    {
        id: 122,
        name:"Scenic_122",
        dateTaken: "2018-03-19",
        description: "San Francisco drop, cartooning.",
        project: "Guess Who’s Coming to Dinner",
        location: "Guthrie Theater - Wurtele Thrust Stage",
        src:"assets/images/scenic/Scenic_122_03.19.2018.jpg"
    },
    {
        id: 123,
        name:"Scenic_123",
        dateTaken: "2018-03-30",
        description: "San Francisco drop.",
        project: "Guess Who’s Coming to Dinner",
        location: "Guthrie Theater - Wurtele Thrust Stage",
        src:"assets/images/scenic/Scenic_123_03.30.2018.jpg"
    },
    {
        id: 124,
        name:"Scenic_124",
        dateTaken: "2018-04-09",
        description: "Compressed bricks and marble, paint.",
        project: "Guess Who’s Coming to Dinner",
        location: "Guthrie Theater - Wurtele Thrust Stage",
        src:"assets/images/scenic/Scenic_124_04.09.2018.jpg"
    },
    {
        id: 125,
        name:"Scenic_125",
        dateTaken: "2018-04-10",
        description: "Compressed bricks and marble, paint.",
        project: "Guess Who’s Coming to Dinner",
        location: "Guthrie Theater - Wurtele Thrust Stage",
        src:"assets/images/scenic/Scenic_125_04.10.2018.jpg"
    },
    {
        id: 126,
        name:"Scenic_126",
        dateTaken: "2018-04-12",
        description: "Concrete floor. Paint and Design.",
        project: "An Enemy of the People",
        location: "Guthrie Theater - McGuire Proscenium Stage",
        src:"assets/images/scenic/Scenic_126_04.12.2018.jpg"
    },
    {
        id: 127,
        name:"Scenic_127",
        dateTaken: "2018-04-20",
        description: "Smooth concrete.",
        project: "An Enemy of the People",
        location: "Guthrie Theater - McGuire Proscenium Stage",
        src:"assets/images/scenic/Scenic_127_04.20.2018.jpg"
    },
    {
        id: 128,
        name:"Scenic_128",
        dateTaken: "2018-04-24",
        description: "Concrete and wood table.",
        project: "An Enemy of the People",
        location: "Guthrie Theater - McGuire Proscenium Stage",
        src:"assets/images/scenic/Scenic_128_04.24.2018.jpg"
    },
    {
        id: 129,
        name:"Scenic_129",
        dateTaken: "2018-06-15",
        description: "Weathered dumpster, paint.",
        project: "The Legend of Georgia McBride",
        location: "Guthrie Theater - McGuire Proscenium Stage",
        src:"assets/images/scenic/Scenic_129_06.15.2018.jpg"
    },
    {
        id: 130,
        name:"Scenic_130",
        dateTaken: "2018-07-11",
        description: "Weathered metal door, chipped paint.",
        project: "The Legend of Georgia McBride",
        location: "Guthrie Theater - McGuire Proscenium Stage",
        src:"assets/images/scenic/Scenic_130_07.11.2018.jpg"
    },
    {
        id: 131,
        name:"Scenic_131",
        dateTaken: "2018-07-20",
        description: "Damaged asphalt street, floor paint on osb.",
        project: "Last Stop on Market Street",
        location: "Children's Theatre Company - UnitedHealth Group Stage",
        src:"assets/images/scenic/Scenic_131_07.20.2018.jpg"
    },
    {
        id: 132,
        name:"Scenic_132",
        dateTaken: "2018-08-09",
        description: "Paint palette, scenic paints.",
        project: "Last Stop on Market Street",
        location: "Children's Theatre Company - UnitedHealth Group Stage",
        src:"assets/images/scenic/Scenic_132_08.09.2018.jpg"
    },
    {
        id: 133,
        name:"Scenic_133",
        dateTaken: "2018-08-09",
        description: "Building wall, grafitti art, paint.",
        project: "Last Stop on Market Street",
        location: "Children's Theatre Company - UnitedHealth Group Stage",
        src:"assets/images/scenic/Scenic_133_08.09.2018.jpg"
    },
    {
        id: 134,
        name:"Scenic_134",
        dateTaken: "2018-08-27",
        description: "Rusted metal streetlights, paint.",
        project: "Last Stop on Market Street",
        location: "Children's Theatre Company - UnitedHealth Group Stage",
        src:"assets/images/scenic/Scenic_134_08.27.2018.jpg"
    },
    {
        id: 135,
        name:"Scenic_135",
        dateTaken: "2018-08-27",
        description: "Rusted metal streetlights, paint.",
        project: "Last Stop on Market Street",
        location: "Children's Theatre Company - UnitedHealth Group Stage",
        src:"assets/images/scenic/Scenic_135_08.27.2018.jpg"
    },
    {
        id: 136,
        name:"Scenic_136",
        dateTaken: "2018-08-27",
        description: "Rusted metal streetlights, paint.",
        project: "Last Stop on Market Street",
        location: "Children's Theatre Company - UnitedHealth Group Stage",
        src:"assets/images/scenic/Scenic_136_08.27.2018.jpg"
    },
    {
        id: 137,
        name:"Scenic_137",
        dateTaken: "2018-08-27",
        description: "Rusted metal streetlights, paint.",
        project: "Last Stop on Market Street",
        location: "Children's Theatre Company - UnitedHealth Group Stage",
        src:"assets/images/scenic/Scenic_137_08.27.2018.jpg"
    },
    {
        id: 138,
        name:"Scenic_138",
        dateTaken: "2018-09-04",
        description: "Faux linoleum floor sample.",
        project: "I Come From Arizona",
        location: "Children's Theatre Company - Cargill Stage",
        src:"assets/images/scenic/Scenic_138_09.04.2018.jpg"
    },
    {
        id: 139,
        name:"Scenic_139",
        dateTaken: "2018-09-11",
        description: "Faux linoleum floor, paint on osb.",
        project: "I Come From Arizona",
        location: "Children's Theatre Company - Cargill Stage",
        src:"assets/images/scenic/Scenic_139_09.11.2018.jpg"
    },
    {
        id: 140,
        name:"Scenic_140",
        dateTaken: "2018-09-11",
        description: "Faux linoleum floor, paint on osb.",
        project: "I Come From Arizona",
        location: "Children's Theatre Company - Cargill Stage",
        src:"assets/images/scenic/Scenic_140_09.11.2018.jpg"
    },
    {
        id: 141,
        name:"Scenic_141",
        dateTaken: "2018-09-27",
        description: "Faux brick build exterior, paint on stretched muslin.",
        project: "I Come From Arizona",
        location: "Children's Theatre Company - Cargill Stage",
        src:"assets/images/scenic/Scenic_141_09.27.2018.jpg"
    },
    {
        id: 142,
        name:"Scenic_142",
        dateTaken: "2018-09-27",
        description: "Faux brick build exterior, paint on stretched muslin.",
        project: "I Come From Arizona",
        location: "Children's Theatre Company - Cargill Stage",
        src:"assets/images/scenic/Scenic_142_09.27.2018.jpg"
    },
    {
        id: 143,
        name:"Scenic_143",
        dateTaken: "2018-12-10",
        description: "Cavern floor, paint on osb.",
        project: "The Hobbit",
        location: "Children's Theatre Company - UnitedHealth Group Stage",
        src:"assets/images/scenic/Scenic_143_12.10.2018.jpg"
    },
    {
        id: 144,
        name:"Scenic_144",
        dateTaken: "2018-12-12",
        description: "Burnt wood effect, clay, glue, jaxan mixture, cut while drying, in process.",
        project: "The Hobbit",
        location: "Children's Theatre Company - UnitedHealth Group Stage",
        src:"assets/images/scenic/Scenic_144_12.12.2018.jpg"
    },
    {
        id: 145,
        name:"Scenic_145",
        dateTaken: "2018-12-12",
        description: "Burnt wood effect, clay, glue, jaxan mixture, cut while drying, in process.",
        project: "The Hobbit",
        location: "Children's Theatre Company - UnitedHealth Group Stage",
        src:"assets/images/scenic/Scenic_145_12.12.2018.jpg"
    },
    {
        id: 146,
        name:"Scenic_146",
        dateTaken: "2018-12-12",
        description: "Burnt wood effect, clay, glue, jaxan mixture, cut while drying, in process.",
        project: "The Hobbit",
        location: "Children's Theatre Company - UnitedHealth Group Stage",
        src:"assets/images/scenic/Scenic_146_12.12.2018.jpg"
    },
    {
        id: 147,
        name:"Scenic_147",
        dateTaken: "2018-12-20",
        description: "Burnt wood effect, clay, glue, jaxan mixture, cut while drying, painted.",
        project: "The Hobbit",
        location: "Children's Theatre Company - UnitedHealth Group Stage",
        src:"assets/images/scenic/Scenic_147_12.20.2018.jpg"
    },
    {
        id: 148,
        name:"Scenic_148",
        dateTaken: "2019-01-24",
        description: "Stencil and air brush work, in progress. Stencil vector graphics.",
        project: "Roald Dahl’s Matilda The Musical",
        location: "Children's Theatre Company - UnitedHealth Group Stage",
        src:"assets/images/scenic/Scenic_148_01.24.2019.jpg"
    },
    {
        id: 149,
        name:"Scenic_149",
        dateTaken: "2019-01-25",
        description: "Stencil and air brush work, in progress.",
        project: "Roald Dahl’s Matilda The Musical",
        location: "Children's Theatre Company - UnitedHealth Group Stage",
        src:"assets/images/scenic/Scenic_149_01.25.2019.jpg"
    },
    {
        id: 150,
        name:"Scenic_150",
        dateTaken: "2019-01-25",
        description: "Stencil and air brush work, finished.",
        project: "Roald Dahl’s Matilda The Musical",
        location: "Children's Theatre Company - UnitedHealth Group Stage",
        src:"assets/images/scenic/Scenic_150_01.25.2019.jpg"
    },
    {
        id: 151,
        name:"Scenic_151",
        dateTaken: "2019-01-28",
        description: "Rusted metal staircase and faux burnt wood stairs.",
        project: "The Hobbit",
        location: "Children's Theatre Company - UnitedHealth Group Stage",
        src:"assets/images/scenic/Scenic_151_01.28.2019.jpg"
    },
    {
        id: 152,
        name:"Scenic_152",
        dateTaken: "2019-02-01",
        description: "Proscenium book layout.",
        project: "Roald Dahl’s Matilda The Musical",
        location: "Children's Theatre Company - UnitedHealth Group Stage",
        src:"assets/images/scenic/Scenic_152_02.01.2019.jpg"
    },
    {
        id: 153,
        name:"Scenic_153",
        dateTaken: "2019-02-07",
        description: "Rusted metal framing.",
        project: "The Hobbit",
        location: "Children's Theatre Company - UnitedHealth Group Stage",
        src:"assets/images/scenic/Scenic_153_02.07.2019.jpg"
    },
    {
        id: 154,
        name:"Scenic_154",
        dateTaken: "2019-02-07",
        description: "Rusted metal framing.",
        project: "The Hobbit",
        location: "Children's Theatre Company - UnitedHealth Group Stage",
        src:"assets/images/scenic/Scenic_154_02.07.2019.jpg"
    },
    {
        id: 155,
        name:"Scenic_155",
        dateTaken: "2019-03-07",
        description: "Set in progress.",
        project: "The Hobbit",
        location: "Children's Theatre Company - UnitedHealth Group Stage",
        src:"assets/images/scenic/Scenic_155_03.07.2019.jpg"
    },
    {
        id: 156,
        name:"Scenic_156",
        dateTaken: "2019-03-20",
        description: "Digital book art, color filtered and sized in Photoshop.",
        project: "Roald Dahl’s Matilda The Musical",
        location: "Children's Theatre Company - UnitedHealth Group Stage",
        src:"assets/images/scenic/Scenic_156_03.20.2019.jpg"
    },
    {
        id: 157,
        name:"Scenic_157",
        dateTaken: "2019-03-27",
        description: "1 minute quick wetblend. Paint on sealed foam.",
        project: "Roald Dahl’s Matilda The Musical",
        location: "Children's Theatre Company - UnitedHealth Group Stage",
        src:"assets/images/scenic/Scenic_157_03.27.2019.jpg"
    },
    {
        id: 158,
        name:"Scenic_158",
        dateTaken: "2019-04-11",
        description: "Faux wood plank floor, chipped paint effect on top. Paint on osb.",
        project: "Roald Dahl’s Matilda The Musical",
        location: "Children's Theatre Company - UnitedHealth Group Stage",
        src:"assets/images/scenic/Scenic_158_04.11.2019.jpg"
    },
    {
        id: 159,
        name:"Scenic_159",
        dateTaken: "2019-04-12",
        description: "Digital book art, glue printed paper on foam form.",
        project: "Roald Dahl’s Matilda The Musical",
        location: "Children's Theatre Company - UnitedHealth Group Stage",
        src:"assets/images/scenic/Scenic_159_04.12.2019.jpg"
    },
    {
        id: 160,
        name:"Scenic_160",
        dateTaken: "2019-04-12",
        description: "Digital book art, glue printed paper on foam form.",
        project: "Roald Dahl’s Matilda The Musical",
        location: "Children's Theatre Company - UnitedHealth Group Stage",
        src:"assets/images/scenic/Scenic_160_04.12.2019.jpg"
    },
    {
        id: 161,
        name:"Scenic_161",
        dateTaken: "2019-04-25",
        description: "Completed proscenium.",
        project: "Roald Dahl’s Matilda The Musical",
        location: "Children's Theatre Company - UnitedHealth Group Stage",
        src:"assets/images/scenic/Scenic_161_04.25.2019.jpg"
    },
    {
        id: 162,
        name:"Scenic_162",
        dateTaken: "2019-04-26",
        description: "Bone props, weathered and painted.",
        project: "Cabal",
        location: "Walking Shadow Theater",
        src:"assets/images/scenic/Scenic_162_04.26.2019.jpg"
    },
    {
        id: 163,
        name:"Scenic_163",
        dateTaken: "2019-05-29",
        description: "Blending frames to printed pixelated graphics.",
        project: "Guys and Dolls",
        location: "Guthrie Theater - Wurtele Thrust Stage",
        src:"assets/images/scenic/Scenic_163_05.29.2019.jpg"
    },
    {
        id: 164,
        name:"Scenic_164",
        dateTaken: "2019-05-30",
        description: "Blending frames to printed pixelated graphics.",
        project: "Guys and Dolls",
        location: "Guthrie Theater - Wurtele Thrust Stage",
        src:"assets/images/scenic/Scenic_164_05.30.2019.jpg"
    },
    {
        id: 165,
        name:"Scenic_165",
        dateTaken: "2019-05-30",
        description: "Blending frames to printed pixelated graphics.",
        project: "Guys and Dolls",
        location: "Guthrie Theater - Wurtele Thrust Stage",
        src:"assets/images/scenic/Scenic_165_05.30.2019.jpg"
    },
    {
        id: 166,
        name:"Scenic_166",
        dateTaken: "2019-06-04",
        description: "Colored metallic foil leafing.",
        project: "Guys and Dolls",
        location: "Guthrie Theater - Wurtele Thrust Stage",
        src:"assets/images/scenic/Scenic_166_06.04.2019.jpg"
    },
    {
        id: 167,
        name:"Scenic_167",
        dateTaken: "2019-06-04",
        description: "Colored metallic foil leafing.",
        project: "Guys and Dolls",
        location: "Guthrie Theater - Wurtele Thrust Stage",
        src:"assets/images/scenic/Scenic_167_06.04.2019.jpg"
    },
    {
        id: 168,
        name:"Scenic_168",
        dateTaken: "2019-06-06",
        description: "Blending frames to printed pixelated graphics.",
        project: "Guys and Dolls",
        location: "Guthrie Theater - Wurtele Thrust Stage",
        src:"assets/images/scenic/Scenic_168_06.06.2019.jpg"
    },
    {
        id: 169,
        name:"Scenic_169",
        dateTaken: "2019-06-06",
        description: "Nova color palette and tools.",
        project: "Guys and Dolls",
        location: "Guthrie Theater - Wurtele Thrust Stage",
        src:"assets/images/scenic/Scenic_169_06.06.2019.jpg"
    },
    {
        id: 170,
        name:"Scenic_170",
        dateTaken: "2019-06-17",
        description: "Hand lettered newstand signage.",
        project: "Floyd's",
        location: "Guthrie Theater - McGuire Proscenium Stage",
        src:"assets/images/scenic/Scenic_170_06.17.2019.jpg"
    },
    {
        id: 171,
        name:"Scenic_171",
        dateTaken: "2019-08-30",
        description: "UV stencil on printed vinyl.",
        project: "2019 Curtain Call Ball",
        location: "Children's Theatre Company - Cargill Theater",
        src:"assets/images/scenic/Scenic_171_08.30.2019.jpg"
    },
    {
        id: 172,
        name:"Scenic_172",
        dateTaken: "2019-08-30",
        description: "UV stencil on printed vinyl.",
        project: "2019 Curtain Call Ball",
        location: "Children's Theatre Company - Cargill Theater",
        src:"assets/images/scenic/Scenic_172_08.30.2019.jpg"
    },
    {
        id: 173,
        name:"Scenic_173",
        dateTaken: "2019-09-17",
        description: "Tree root backdrop structure rendering.",
        project: "Snow White",
        location: "Children's Theatre Company - Cargill Theater",
        src:"assets/images/scenic/Scenic_173_09.17.2019.jpg"
    },
    {
        id: 174,
        name:"Scenic_174",
        dateTaken: "2019-09-20",
        description: "Tree stage install in process.",
        project: "Snow White",
        location: "Children's Theatre Company - Cargill Theater",
        src:"assets/images/scenic/Scenic_174_09.20.2019.jpg"
    },
    {
        id: 175,
        name:"Scenic_175",
        dateTaken: "2019-11-20",
        description: "Graphic stencil for texture and paint.",
        project: "Bob Marley’s Three Little Birds",
        location: "Children's Theatre Company - UnitedHealth Group Stage",
        src:"assets/images/scenic/Scenic_175_11.20.2019.jpg"
    },
    {
        id: 176,
        name:"Scenic_176",
        dateTaken: "2019-12-03",
        description: "Textured and painted proscenium.",
        project: "Bob Marley’s Three Little Birds",
        location: "Children's Theatre Company - UnitedHealth Group Stage",
        src:"assets/images/scenic/Scenic_176_12.03.2019.jpg"
    },
    {
        id: 177,
        name:"Scenic_177",
        dateTaken: "2020-01-08",
        description: "Floor paint. Low resolution photoshop interpretation.",
        project: "Bob Marley’s Three Little Birds",
        location: "Children's Theatre Company - UnitedHealth Group Stage",
        src:"assets/images/scenic/Scenic_177_01.08.2020.jpg"
    },
    {
        id: 178,
        name:"Scenic_178",
        dateTaken: "2020-01-13",
        description: "Completed set, proscenium.",
        project: "Bob Marley’s Three Little Birds",
        location: "Children's Theatre Company - UnitedHealth Group Stage",
        src:"assets/images/scenic/Scenic_178_01.13.2020.jpg"
    },
    {
        id: 179,
        name:"Scenic_179",
        dateTaken: "2020-01-14",
        description: "Graphic ladder, sight sizing from proscenium graphic",
        project: "Bob Marley’s Three Little Birds",
        location: "Children's Theatre Company - UnitedHealth Group Stage",
        src:"assets/images/scenic/Scenic_179_01.14.2020.jpg"
    },
    {
        id: 180,
        name:"Scenic_180",
        dateTaken:"2020-01-27",
        description: "worn concrete floor",
        project: "Spamtown, USA",
        location: "Children's Theatre Company - Cargill Theater",
        src:"assets/images/scenic/Scenic_180_01.27.2020.jpg",
    },
    {
        id: 181,
        name:"Scenic_181",
        dateTaken:"2020-10-17",
        description: "Rusted metal staircase and faux burnt wood stairs",
        project: "The Hobbit",
        location: "Children's Theatre Company - UnitedHealth Group Stage",
        src:"assets/images/scenic/Scenic_181_10.17.2020.jpg",
    }
]